{
  "schema_version": "0.6",
  "meta": {
    "title": "市场热点简报（最小样例）",
    "question_type": "market",
    "analysis_mode": "market_event",
    "time_window": "2026-06-12—2026-06-14",
    "market_session": "post",
    "generated_at": "2026-06-14T18:00:00+08:00",
    "source_scope": "公开公告、主流财经媒体、机构公开观点",
    "disclaimer_id": "standard_v2_full_risk_notice",
    "locale": "zh-CN"
  },
  "section_flags": {
    "timeline": true,
    "update_diff": false
  },
  "dialog_brief": {
    "verdict": "样例热点的关键不在单条新闻本身，而在后续验证节奏是否连续出现。",
    "executive_summary": "这是一份最小有效样例，但对话框仍要能独立读懂。它先用官方事实给出事件起点，再用媒体报道补充市场反应，并用机构观点提示反向条件；读者不打开 HTML 也能知道核心判断、关键依据、分歧点、后续验证信号和信息边界。",
    "key_points": [
      {
        "label": "事实变化",
        "text": "官方事实给出事件起点，说明这条信息已经从背景讨论进入可跟踪窗口，后续可以用公开数据继续验证变化是否持续。",
        "refs": [1]
      },
      {
        "label": "市场含义",
        "text": "媒体报道补充市场反应，帮助判断这条信息是否已经影响交易关注度，也能区分短期情绪和更稳定的市场主线。",
        "refs": [2]
      },
      {
        "label": "分歧点",
        "text": "机构观点提示反向条件，说明市场仍需要后续公开数据来确认持续性，不能只凭单条消息就把影响外推得过远。",
        "refs": [3]
      },
      {
        "label": "后续验证",
        "text": "后续重点看公开数据是否继续改善，以及更多来源是否形成相互印证；如果证据断档，核心判断就需要下修。",
        "refs": [1, 2, 3]
      }
    ],
    "watch_signals": [
      "官方口径下公开数据继续改善",
      "更多权威来源形成印证"
    ],
    "risk_boundary": "这里只做公开信息梳理和验证条件拆解，不构成投资建议。"
  },
  "insight": {
    "one_sentence": "样例热点需要用后续数据验证市场反应是否持续。",
    "why_now": "现在重要，是因为新增官方事实刚出现，市场反应和机构观点还没有完全对齐。",
    "what_changed": "相比上一阶段，新增信息从背景讨论进入了可跟踪的时间窗口。",
    "consensus_vs_delta": "共识是事件本身值得关注，分歧在后续数据能否支撑市场继续定价。",
    "positive_case": "如果后续公开数据继续改善，市场对这条主线的信心会更容易维持。",
    "negative_case": "如果数据没有跟上，前期反应可能只是短期情绪而不是基本变化。",
    "confirm_signals": [
      "数据继续改善",
      "更多来源印证"
    ],
    "invalidate_signals": [
      "数据未跟上",
      "机构继续下修"
    ],
    "confidence": "中"
  },
  "reading_budget": {
    "thirty_second": "这是一份最小有效样例，但核心观点仍要能独立读懂：官方事实给出事件起点，媒体报道补充市场反应，机构观点提示反向条件。读者先看新增事实，再看影响链和验证信号，最后回到底部来源核对证据。即使是最小样例，也不能只给一句判断，而要交代事实从哪里来、市场为什么关注、后续用什么条件验证。",
    "one_minute": [
      "核心观点",
      "关键增量信息",
      "为什么重要",
      "验证/证伪信号"
    ],
    "three_minute": [
      "市场影响链",
      "各方观点",
      "信息来源"
    ],
    "default_news_count": 3,
    "max_frontstage_chars": 1200
  },
  "section_summaries": {
    "impact": "关键不在单条新增事实本身，而在它能否被后续公开数据接住；如果数据没有延续，市场影响更像短期关注升温，而不是趋势已经兑现。",
    "viewpoints": "真正的分歧不是官方事实是否出现，而是媒体关注和机构谨慎能否被同一组后续数据解释清楚；如果解释不了，核心判断只能保持低信心。",
    "verification": "最小验证信号不是讨论热度上升，而是数据继续改善且机构没有继续下修；如果数据断档，前期反应就需要从趋势判断下修为短线波动。"
  },
  "highlight": {
    "lead_ref": 1,
    "main_signal": "验证窗口",
    "key_change": "新增事实出现",
    "watch_point": "后续数据",
    "tone": "neutral"
  },
  "visuals": {
    "summary_cards": [
      {
        "label": "事实起点",
        "value": "官方发布"
      },
      {
        "label": "市场反应",
        "value": "媒体跟踪升温",
        "tone": "positive"
      },
      {
        "label": "反向条件",
        "value": "机构仍需验证",
        "tone": "risk"
      }
    ],
    "impact_chain": [
      "官方事实出现",
      "市场关注升温",
      "机构重新评估",
      "后续数据验证"
    ],
    "impact_facts": [
      {
        "step": 1,
        "fact": "官方来源给出事件起点和时间窗口，读者可以从原文核对发布时间、涉及范围和后续观察节点；这一步决定后面所有市场解读能否站在可靠事实和统一口径上。",
        "refs": [
          1
        ]
      },
      {
        "step": 2,
        "fact": "媒体报道补充市场反应和关注方向，让简报能够区分事实本身与短期交易情绪；如果反应只停留在情绪层面，后续仍需要更多公开数据验证，不能直接外推结论。",
        "refs": [
          2
        ]
      },
      {
        "step": 3,
        "fact": "机构观点提供反向条件，提醒后续仍要看数据是否继续改善；这一层能帮助读者判断市场是在重估基本变量，还是只是在交易单条新闻和短期情绪变化本身而已。",
        "refs": [
          3
        ]
      },
      {
        "step": 4,
        "fact": "后续数据验证决定核心判断能否延续，重点看官方口径、市场反应和机构修正是否互相印证；如果证据链断开，结论需要及时下修并说明依据变化和缺口所在。",
        "refs": [
          1,
          2,
          3
        ]
      }
    ],
    "timeline": [
      {
        "date": "2026-06-12",
        "label": "官方来源发布新增事实",
        "kind": "official"
      },
      {
        "date": "2026-06-13",
        "label": "媒体报道市场反应",
        "kind": "media"
      },
      {
        "date": "2026-06-14",
        "label": "机构观点补充反向条件",
        "kind": "institution"
      }
    ]
  },
  "screen1": {
    "main_thread": "验证窗口",
    "biggest_change": "新增事实出现",
    "controversy": "分歧在持续性",
    "controversy_level": "中",
    "watch_next": "后续数据是否跟上"
  },
  "news_items": [
    {
      "title": "官方披露事件时间窗口",
      "ref": 1,
      "time": "2026-06-12 10:00",
      "importance": "高",
      "why": "6月12日官方来源发布新增事实，给市场提供了明确起点和时间窗口；这条信息本身不等于趋势已经形成，但后续可以继续核对涉及范围、执行进展、口径变化、时间表调整和更多公开数据是否连续出现。",
      "category": "政策"
    },
    {
      "title": "媒体报道市场关注升温",
      "ref": 2,
      "time": "2026-06-13 09:30",
      "importance": "中",
      "why": "6月13日媒体报道补充市场反应和关注方向，短期讨论从事件本身延伸到可能受影响的环节；关注度已经升温，但持续性仍需要后续数据、更多来源和机构观点继续确认，避免把情绪反应当成趋势判断。",
      "category": "市场反应"
    },
    {
      "title": "机构观点提示后续验证条件",
      "ref": 3,
      "time": "2026-06-14",
      "importance": "中",
      "why": "6月14日机构观点提示仍需跟踪数据是否继续改善，核心分歧在持续性而不是事件是否发生；如果后续数据断档、更多来源没有形成印证，前期市场反应可能只是短期情绪而不是稳定主线，需要保留反向观察。",
      "category": "机构观点"
    }
  ],
  "interpretation": [
    {
      "role": "客观事实",
      "point": "客观事实层面，官方来源给出了事件起点和后续时间窗口，简报可以据此建立主线；但这还只是信息增量，不能直接推出市场影响已经完全兑现。",
      "refs": [
        1
      ]
    },
    {
      "role": "市场反应",
      "point": "市场反应层面，媒体报道显示关注度已经升温，交易讨论开始围绕可能受影响的环节展开；这说明事件进入定价视野，但仍需要更多事实印证。",
      "refs": [
        2
      ]
    },
    {
      "role": "反向证据",
      "point": "反向证据层面，机构观点强调后续数据验证仍是关键，如果新增数据没有持续改善，前期关注可能回落，因此证伪条件要和核心观点并列展示。",
      "refs": [
        3
      ]
    }
  ],
  "verification": {
    "confirm": [
      {
        "signal": "数据继续改善",
        "watch": "观察后续公开数据是否延续当前方向",
        "meaning": "若延续，核心观点的可信度会提高。",
        "refs": [
          1,
          2
        ]
      },
      {
        "signal": "更多来源印证",
        "watch": "观察媒体和机构是否从不同角度确认同一事实",
        "meaning": "若出现多源印证，市场反应更可能持续。",
        "refs": [
          2,
          3
        ]
      }
    ],
    "invalidate": [
      {
        "signal": "数据未跟上",
        "watch": "观察后续公开数据是否低于当前讨论口径",
        "meaning": "若未跟上，前期市场反应可能减弱。",
        "refs": [
          3
        ]
      },
      {
        "signal": "机构继续下修",
        "watch": "观察机构是否继续调低后续判断",
        "meaning": "若继续下修，说明分歧尚未消除。",
        "refs": [
          3
        ]
      }
    ]
  },
  "timeline": [
    {
      "date": "2026-06-12",
      "event": "官方来源发布新增事实",
      "kind": "official"
    },
    {
      "date": "2026-06-13",
      "event": "媒体报道市场关注升温",
      "kind": "media"
    },
    {
      "date": "2026-06-14",
      "event": "机构观点提示后续验证条件",
      "kind": "institution"
    }
  ],
  "source_check": {
    "official": [
      1
    ],
    "media": [
      2
    ],
    "institution": [
      3
    ],
    "internal_excluded": []
  },
  "query_log": [
    {
      "query": "样例热点 官方 新增事实",
      "intent": "验证官方事实起点",
      "source_scope": "官方来源",
      "result_count": 1,
      "used_refs": [
        1
      ]
    },
    {
      "query": "样例热点 市场反应 媒体",
      "intent": "验证市场反应",
      "source_scope": "主流财经媒体",
      "result_count": 1,
      "used_refs": [
        2
      ]
    }
  ],
  "evidence_atoms": [
    {
      "claim": "官方来源发布新增事实并给出时间窗口。",
      "source": "官方来源",
      "url": "https://example.com/official-minimal",
      "date": "2026-06-12 10:00",
      "excerpt": "新增事实和时间窗口可从官方原文核对。",
      "context": "最小样例的事实起点。",
      "confidence": "HIGH",
      "refs": [
        1
      ]
    },
    {
      "claim": "媒体报道显示市场关注升温。",
      "source": "财经媒体",
      "url": "https://example.com/media-minimal",
      "date": "2026-06-13 09:30",
      "excerpt": "市场关注方向从事件本身延伸到后续数据。",
      "context": "最小样例的市场反应。",
      "confidence": "MEDIUM",
      "refs": [
        2
      ]
    }
  ],
  "coverage_gaps": [
    {
      "angle": "真实后续数据",
      "reason": "最小样例只用于格式锚定，不代表真实市场结论",
      "next_query": "后续数据 官方 披露"
    }
  ],
  "conflicts": [
    {
      "claim": "市场反应是否持续",
      "source_a": "媒体报道显示关注升温",
      "source_b": "机构观点强调仍需验证",
      "nature": "短期反应与后续验证口径不同",
      "handling": "前台表达为关注升温但持续性仍需数据确认"
    }
  ],
  "references": [
    {
      "id": 1,
      "title": "官方来源发布新增事实",
      "source": "官方来源",
      "level": "A",
      "type": "official",
      "corroboration": 2,
      "date": "2026-06-12 10:00",
      "url": "https://example.com/official-minimal"
    },
    {
      "id": 2,
      "title": "财经媒体报道市场反应",
      "source": "财经媒体",
      "level": "B",
      "type": "media",
      "corroboration": 2,
      "date": "2026-06-13 09:30",
      "url": "https://example.com/media-minimal"
    },
    {
      "id": 3,
      "title": "机构观点提示后续验证",
      "source": "机构观点",
      "level": "C",
      "type": "institution",
      "corroboration": 1,
      "date": "2026-06-14",
      "url": "https://example.com/institution-minimal"
    }
  ]
}
